UC 1 - Ability to create a Address Book Service DB Use SQL Client to create DB.
--------------------------------------------------------------------------------------------------------

mysql> create database AddressBook_Service;
Query OK, 1 row affected (0.01 sec)

mysql> show databases;
+---------------------+
| Database            |
+---------------------+
| addressbook_service |
| information_schema  |
| mysql               |
| payroll_service     |
| performance_schema  |
| sakila              |
| sys                 |
| world               |
+---------------------+
8 rows in set (0.00 sec)

mysql> use addressbook_service;
Database changed

--------------------------------------------------------------------------------------------------------
UC 2 - Ability to create a AddressBook Table with first and last names, address, city, state, zip,
       phone number and email as its attributes.
--------------------------------------------------------------------------------------------------------

mysql> create table AddressBook(
    -> FirstName Varchar(20) not null,
    -> LastName Varchar(20) not null,
    -> Address Varchar(20) not null,
    -> City Varchar(20) not null,
    -> State Varchar(20) not null,
    -> Zip Varchar(20) not null,
    -> PhoneNo Varchar(20) not null,
    -> Email Varchar(20) not null);
Query OK, 0 rows affected (0.03 sec)

mysql> show tables;
+-------------------------------+
| Tables_in_addressbook_service |
+-------------------------------+
| addressbook                   |
+-------------------------------+
1 row in set (0.00 sec)

--------------------------------------------------------------------------------------------------------
UC 3 - Ability to insert new Contacts to Address Book.
--------------------------------------------------------------------------------------------------------

mysql> insert into addressbook(
    -> FirstName,LastName,Address,City,State,Zip,PhoneNo,Email) values
    -> ('Shiwani','Paunikar','Jogithana','Umred','MH','443007','8908641811','shiw@gmail.com'),
    -> ('Sonu','Bhide','Itwari','Umred','MH','444021','7008565646','sonu@gmail.com'),
    -> ('Nilam','Bedi','Jagnade','Nagpur','MH','444001','9937585846','nilam50@gmail.com');
Query OK, 3 rows affected (0.01 sec)
Records: 3  Duplicates: 0  Warnings: 0

mysql> select * from addressbook
    -> ;
+-----------+----------+----------+---------+--------+--------+------------+-------------------+
| FirstName | LastName | Address  | City    | State  | Zip    | PhoneNo    | Email             |
+-----------+----------+----------+---------+--------+--------+------------+-------------------+
| Shiwani   | Paunikar | Jogithana| Umred   | MH     | 443007 | 8908641811 | shiw@gmail.com    |
| Sonu      | Bhide    | Itwari   | Umred   | MH     | 444021 | 7008565646 | sonu@gmail.com    |
| Nilam     | Bedi     | Jagnade  | Nagpur  | MH     | 444001 | 9937585846 | nilam50@gmail.com |
+-----------+----------+----------+---------+--------+--------+------------+-------------------+
3 rows in set (0.00 sec)

--------------------------------------------------------------------------------------------------------
UC 4 - Ability to edit existing contact person using their name.
--------------------------------------------------------------------------------------------------------

mysql> update addressbook set PhoneNo = '8249837408' where FirstName = 'Shiwani';
Query OK, 1 row affected (0.00 sec)
Rows matched: 1  Changed: 1  Warnings: 0

mysql> update addressbook set Zip = '754033' where FirstName = 'Sonu';
Query OK, 1 row affected (0.00 sec)
Rows matched: 1  Changed: 1  Warnings: 0

mysql> select * from addressbook;
+-----------+----------+----------+---------+--------+--------+------------+-------------------+
| FirstName | LastName | Address  | City    | State  | Zip    | PhoneNo    | Email             |
+-----------+----------+----------+---------+--------+--------+------------+-------------------+
| Shiwani   | Paunikar | Jogithana| Umred   | MH     | 443007 | 8249837408 | shiw@gmail.com    |
| Sonu      | Bhide    | Itwari   | Umred   | MH     | 754033 | 7008565646 | sonu@gmail.com    |
| Nilam     | Bedi     | Jagnade  | Nagpur  | MH     | 444001 | 9937585846 | nilam50@gmail.com |
+-----------+----------+----------+---------+--------+--------+------------+-------------------+
3 rows in set (0.00 sec)

--------------------------------------------------------------------------------------------------------
UC 5 - Ability to delete a contact person using person's name.
--------------------------------------------------------------------------------------------------------

mysql> delete from addressbook where FirstName = 'Nilam';
Query OK, 1 row affected (0.01 sec)

mysql> select * from addressbook;
+-----------+----------+----------+---------+--------+--------+------------+-------------------+
| FirstName | LastName | Address  | City    | State  | Zip    | PhoneNo    | Email             |
+-----------+----------+----------+---------+--------+--------+------------+-------------------+
| Shiwani   | Paunikar | Jogithana| Umred   | MH     | 443007 | 8249837408 | shiw@gmail.com    |
| Sonu      | Bhide    | Itwari   | Umred   | MH     | 754033 | 7008565646 | sonu@gmail.com    |
+-----------+----------+----------+---------+--------+--------+------------+-------------------+
2 rows in set (0.00 sec)

--------------------------------------------------------------------------------------------------------
UC 6 - Ability to retrieve person's belonging to a city or state from the Address Book.
--------------------------------------------------------------------------------------------------------

mysql> insert into addressbook(
    ->  FirstName,LastName,Address,City,State,Zip,PhoneNo,Email) values
    ->  ('Prati','Paunikar','Thane','Mumbai','MH','440221','7008456545','prati@gmail.com');
Query OK, 1 row affected (0.02 sec)

mysql> select * from addressbook where city = 'Umred' or State = 'MH';
+-----------+----------+-----------+--------+-------+--------+------------+-----------------+
| FirstName | LastName | Address   | City   | State | Zip    | PhoneNo    | Email           |
+-----------+----------+-----------+--------+-------+--------+------------+-----------------+
| Shiwani   | Paunikar | Jogithana | Umred  | MH    | 443007 | 8249837408 | shiw@gmail.com  |
| Sonu      | Bhide    | Itwari    | Umred  | MH    | 754033 | 7008565646 | sonu@gmail.com  |
| Prati     | Paunikar | Thane     | Mumbai | MH    | 440221 | 7008456545 | prati@gmail.com |
+-----------+----------+-----------+--------+-------+--------+------------+-----------------+
3 rows in set (0.00 sec)

--------------------------------------------------------------------------------------------------------
UC 7 - Ability to understand the size of address book by city and state.
     - Here size indicates the count
--------------------------------------------------------------------------------------------------------
mysql> select * from addressbook;
+-----------+----------+-----------+--------+-------+--------+------------+-----------------+
| FirstName | LastName | Address   | City   | State | Zip    | PhoneNo    | Email           |
+-----------+----------+-----------+--------+-------+--------+------------+-----------------+
| Shiwani   | Paunikar | Jogithana | Umred  | MH    | 443007 | 8249837408 | shiw@gmail.com  |
| Sonu      | Bhide    | Itwari    | Umred  | MH    | 754033 | 7008565646 | sonu@gmail.com  |
| Prati     | Paunikar | Thane     | Mumbai | MH    | 440221 | 7008456545 | prati@gmail.com |
+-----------+----------+-----------+--------+-------+--------+------------+-----------------+
3 rows in set (0.02 sec)

mysql> select count(City), count(State) from addressbook;
+-------------+--------------+
| count(City) | count(State) |
+-------------+--------------+
|           3 |            3 |
+-------------+--------------+
1 row in set (0.11 sec)

mysql>  select count(FirstName) from addressbook;
+------------------+
| count(FirstName) |
+------------------+
|                3 |
+------------------+
1 row in set (0.01 sec)
mysql>  select count(*) from addressbook where State = 'MH';
+----------+
| count(*) |
+----------+
|        3 |
+----------+
1 row in set (0.00 sec)

mysql> select count(*) from addressbook where City = 'Umred';
+----------+
| count(*) |
+----------+
|        2 |
+----------+
1 row in set (0.00 sec)
UC 8 - Ability to retrieve entries sorted alphabetically by Person’s name for a given city.
-------------------------------------------------------------------------------------------------------

mysql> select * from addressbook where City = 'Umred' order by FirstName ASC;
+-----------+----------+-----------+-------+-------+--------+------------+----------------+
| FirstName | LastName | Address   | City  | State | Zip    | PhoneNo    | Email          |
+-----------+----------+-----------+-------+-------+--------+------------+----------------+
| Shiwani   | Paunikar | Jogithana | Umred | MH    | 443007 | 8249837408 | shiw@gmail.com |
| Sonu      | Bhide    | Itwari    | Umred | MH    | 754033 | 7008565646 | sonu@gmail.com |
+-----------+----------+-----------+-------+-------+--------+------------+----------------+
2 rows in set (0.01 sec)